বই,হাদিস নাম্বার,হাদিসের মান,আরবি,বর্ণনাকারী,বাংলা
১০০ সুসাব্যস্ত হাদিস,৩২,সহিহ হাদিস,,আবূ হুরায়রা (রাঃ) থেকে বর্ণিত:,"রাসূলুল্লাহ (সাল্লাল্লাহু ‘আলাইহি ওয়া সাল্লাম) জুমআ’র দিনের উল্লেখ করে বললেন, ‘এই দিনে এমন একটি মুহূর্ত রয়েছে যে, কোন মুসলিম বান্দা যদি এই মুহূর্তে দাঁড়িয়ে নামায পড়া অবস্থায় আল্লাহ্ নিকট কোন কিছু চায়, তাহলে তিনি তাকে অবশ্যই তা দান করেন। আর তিনি হাত দিয়ে ইঙ্গিত করে বুঝিয়ে দিলেন যে, সে মুহূর্তটি খুবই সংক্ষিপ্ত।’ (বুখারী ৯৩৫, মুসলিম ৮৫২)"
১০০ সুসাব্যস্ত হাদিস,৩৩,সহিহ হাদিস,,জাবির (রাঃ) থেকে বর্ণিত:,"তিনি বলেন, নবী করীম (সাল্লাল্লাহু ‘আলাইহি ওয়া সাল্লাম) ঈদের দিন (ফেরার সময়) ভিন্ন পথে আসতেন। (বুখারী ৯৮৬)"
১০০ সুসাব্যস্ত হাদিস,৩৪,সহিহ হাদিস,,আবূ হুরায়রা (রাঃ) থেকে বর্ণিত:,"তিনি বলেন, রাসূলুল্লাহ (সাল্লাল্লাহু ‘আলাইহি ওয়া সাল্লাম) বলেছেন, “যে ব্যক্তি জানাযায় শরীক হয়ে নামায পড়া পর্যন্ত থাকে, সে এক ক্বীরাত নেকী পায়। আর যে তাতে শরীক হয়ে কবরস্থ করা পর্যন্ত থাকে, সে দু’ক্বীরাত নেকী পায়।' জিজ্ঞাসা করা হলো, দুই ক্বীরাত কি? বললেন, দু’টি বড় বড় পাহাড়ের মত।” (মুসলিম ৯৪৫)"
১০০ সুসাব্যস্ত হাদিস,৩৫,সহিহ হাদিস,,বুরায়দা (রাঃ) থেকে বর্ণিত:,"তিনি বলেন, রাসূলুল্লাহ (সাল্লাল্লাহু ‘আলাইহি ওয়া সাল্লাম) বলেছেন, “আমি তোমাদেরকে কবর যিয়ারত করতে নিষেধ করেছিলাম এখন তোমরা উহার যিয়ারত করো।” (মুসলিম ৯৭৭)"
,,,,,
