বই,হাদিস নাম্বার,হাদিসের মান,আরবি,বর্ণনাকারী,বাংলা
সুনানে ইবনে মাজাহ,১০০২,,حَدَّثَنَا زَيْدُ بْنُ أَخْزَمَ أَبُو طَالِبٍ، حَدَّثَنَا أَبُو دَاوُدَ، وَأَبُو قُتَيْبَةَ قَالاَ حَدَّثَنَا هَارُونُ بْنُ مُسْلِمٍ، عَنْ قَتَادَةَ، عَنْ مُعَاوِيَةَ بْنِ قُرَّةَ، عَنْ أَبِيهِ، قَالَ كُنَّا نُنْهَى أَنْ نَصُفَّ، بَيْنَ السَّوَارِي عَلَى عَهْدِ رَسُولِ اللَّهِ ـ صلى الله عليه وسلم ـ وَنُطْرَدُ عَنْهَا طَرْدًا .,মুআবিয়াহ বিন কুররাহ থেকে বর্ণিত:,"তার পিতা (রাঃ) থেকে তার পিতার সূত্রে বর্ণিত। তিনি বলেন, রসূলুল্লাহ (সাল্লাল্লাহু ‘আলাইহি ওয়া সাল্লাম) -এর যমানায় আমাদেরকে দু’ খুঁটির মাঝখানে কাতারবন্দী হতে নিষেধ করা হতো এবং আমাদেরকে কঠোরভাবে বিরত রাখা হতো।[১০০২]"
সুনানে ইবনে মাজাহ,১০০৩,,"حَدَّثَنَا أَبُو بَكْرِ بْنُ أَبِي شَيْبَةَ، حَدَّثَنَا مُلاَزِمُ بْنُ عَمْرٍو، عَنْ عَبْدِ اللَّهِ بْنِ بَدْرٍ، حَدَّثَنِي عَبْدُ الرَّحْمَنِ بْنُ عَلِيِّ بْنِ شَيْبَانَ، عَنْ أَبِيهِ، عَلِيِّ بْنِ شَيْبَانَ - وَكَانَ مِنَ الْوَفْدِ - قَالَ خَرَجْنَا حَتَّى قَدِمْنَا عَلَى النَّبِيِّ ـ صلى الله عليه وسلم ـ فَبَايَعْنَاهُ وَصَلَّيْنَا خَلْفَهُ ثُمَّ صَلَّيْنَا وَرَاءَهُ صَلاَةً أُخْرَى فَقَضَى الصَّلاَةَ فَرَأَى رَجُلاً فَرْدًا يُصَلِّي خَلْفَ الصَّفِّ . قَالَ فَوَقَفَ عَلَيْهِ نَبِيُّ اللَّهِ ـ صلى الله عليه وسلم ـ حِينَ انْصَرَفَ قَالَ "" اسْتَقْبِلْ صَلاَتَكَ لاَ صَلاَةَ لِلَّذِي خَلْفَ الصَّفِّ "" .",আলী বিন শায়বান (রাঃ) থেকে বর্ণিত:,"তিনি বলেন, আমরা এক প্রতিনিধি দল রওয়ানা হয়ে নবী (সাল্লাল্লাহু ‘আলাইহি ওয়া সাল্লাম) -এর দরবারে উপস্থিত হলাম। আমরা তাঁর নিকট বাইআত (ইসলাম) গ্রহণ করলাম এবং তাঁর পিছনে সালাত পড়লাম, অতঃপর তাঁর পিছনে আরো এক ওয়াক্তের সালাত পড়লাম। তিনি সালাত শেষে এক ব্যক্তিকে কাতারের পেছনে একাকী দাঁড়িয়ে সালাত আদায় করতে দেখলেন। রাবী বলেন, নবী (সাল্লাল্লাহু ‘আলাইহি ওয়া সাল্লাম) তার নিকট থামলেন এবং সে সালাত শেষ করলে তিনি তাকে বলেন তুমি পুনরায় সালাত পড়ো। কারণ যে ব্যক্তি কাতারের পেছনে এককী দাঁড়ায় তার সালাত হয় না। [১০০৩]"
সুনানে ইবনে মাজাহ,১০০৪,,حَدَّثَنَا أَبُو بَكْرِ بْنُ أَبِي شَيْبَةَ، حَدَّثَنَا عَبْدُ اللَّهِ بْنُ إِدْرِيسَ، عَنْ حُصَيْنٍ، عَنْ هِلاَلِ بْنِ يَسَافٍ، قَالَ أَخَذَ بِيَدِي زِيَادُ بْنُ أَبِي الْجَعْدِ فَأَوْقَفَنِي عَلَى شَيْخٍ بِالرَّقَّةِ يُقَالُ لَهُ وَابِصَةُ بْنُ مَعْبَدٍ فَقَالَ صَلَّى رَجُلٌ خَلْفَ الصَّفِّ وَحْدَهُ فَأَمَرَهُ النَّبِيُّ ـ صلى الله عليه وسلم ـ أَنْ يُعِيدَ .,ওয়াবিসাহ বিন মা‘বাদ (রাঃ) থেকে বর্ণিত:,"হিলাল বলেন, যিয়াদ বিন আবূল জা‘দ আমার হাত ধরে আর-রাক্কা নামক স্থানে ওয়াবিসাহ বিন মা‘বাদ (রাঃ) নামক প্রবীণ ব্যক্তির নিকট নিয়ে যান। তিনি বলেন, এক ব্যক্তি কাতারের পিছনে এককী সালাত পড়লে নবী (সাল্লাল্লাহু ‘আলাইহি ওয়া সাল্লাম) তাকে তা পুনর্বার পড়ার নিদের্শ দেন। [১০০৪]"
সুনানে ইবনে মাজাহ,১০০৫,,"حَدَّثَنَا عُثْمَانُ بْنُ أَبِي شَيْبَةَ، حَدَّثَنَا مُعَاوِيَةُ بْنُ هِشَامٍ، حَدَّثَنَا سُفْيَانُ، عَنْ أُسَامَةَ بْنِ زَيْدٍ، عَنْ عُثْمَانَ بْنِ عُرْوَةَ، عَنْ عُرْوَةَ، عَنْ عَائِشَةَ، قَالَتْ قَالَ رَسُولُ اللَّهِ ـ صلى الله عليه وسلم ـ "" إِنَّ اللَّهَ وَمَلاَئِكَتَهُ يُصَلُّونَ عَلَى مَيَامِنِ الصُّفُوفِ "" .",আয়িশা (রাঃ) থেকে বর্ণিত:,"তিনি বলেন, রসূলুল্লাহ (সাল্লাল্লাহু ‘আলাইহি ওয়া সাল্লাম) বলেছেন, আল্লাহ ও তাঁর ফেরেশতাকগণ কাতারসমূহের ডান দিকের (মুসল্লিদের) উপর রহমত বর্ষণ করেন।[১০০৫]"
সুনানে ইবনে মাজাহ,১০০৬,,حَدَّثَنَا عَلِيُّ بْنُ مُحَمَّدٍ، حَدَّثَنَا وَكِيعٌ، عَنْ مِسْعَرٍ، عَنْ ثَابِتِ بْنِ عُبَيْدٍ، عَنِ ابْنِ الْبَرَاءِ بْنِ عَازِبٍ، عَنِ الْبَرَاءِ، قَالَ كُنَّا إِذَا صَلَّيْنَا خَلْفَ رَسُولِ اللَّهِ ـ صلى الله عليه وسلم ـ - قَالَ مِسْعَرٌ - مِمَّا نُحِبُّ أَوْ مِمَّا أُحِبُّ أَنْ نَقُومَ عَنْ يَمِينِهِ .,আল-বারা’ বিন আযিব (রাঃ) থেকে বর্ণিত:,"তিনি বলেন, আমরা যখন রসূলুল্লাহ (সাল্লাল্লাহু ‘আলাইহি ওয়া সাল্লাম) -এর পেছনে সালাত পড়তাম তখন কাতারের ডান দিকে দাঁড়াতে পছন্দ করতাম।[১০০৬]"
সুনানে ইবনে মাজাহ,১০০৭,,"حَدَّثَنَا مُحَمَّدُ بْنُ أَبِي الْحُسَيْنِ أَبُو جَعْفَرٍ، حَدَّثَنَا عَمْرُو بْنُ عُثْمَانَ الْكِلاَبِيُّ، حَدَّثَنَا عُبَيْدُ اللَّهِ بْنُ عَمْرٍو الرَّقِّيُّ، عَنْ لَيْثِ بْنِ أَبِي سُلَيْمٍ، عَنْ نَافِعٍ، عَنِ ابْنِ عُمَرَ، قَالَ قِيلَ لِلنَّبِيِّ ـ صلى الله عليه وسلم ـ إِنَّ مَيْسَرَةَ الْمَسْجِدِ تَعَطَّلَتْ . فَقَالَ النَّبِيُّ ـ صلى الله عليه وسلم ـ "" مَنْ عَمَّرَ مَيْسَرَةَ الْمَسْجِدِ كُتِبَ لَهُ كِفْلاَنِ مِنَ الأَجْرِ "" .",ইবনু উমার (রাঃ) থেকে বর্ণিত:,"তিনি বলেন, নবী (সাল্লাল্লাহু ‘আলাইহি ওয়া সাল্লাম) -কে বলা হলো, মাসজিদের বাম দিক খালি হয়ে গেছে। নবী (সাল্লাল্লাহু ‘আলাইহি ওয়া সাল্লাম) বলেন, যে ব্যক্তি মাসজিদের বাম দিকের খালি জায়গা পূর্ণ করবে, তার জন্য দ্বিগুণ পুরস্কার লিপিবদ্ধ করা হয়।[১০০৭]"
সুনানে ইবনে মাজাহ,১০০৮,,حَدَّثَنَا الْعَبَّاسُ بْنُ عُثْمَانَ الدِّمَشْقِيُّ، حَدَّثَنَا الْوَلِيدُ بْنُ مُسْلِمٍ، حَدَّثَنَا مَالِكُ بْنُ أَنَسٍ، عَنْ جَعْفَرِ بْنِ مُحَمَّدٍ، عَنْ أَبِيهِ، عَنْ جَابِرٍ، أَنَّهُ قَالَ لَمَّا فَرَغَ رَسُولُ اللَّهِ ـ صلى الله عليه وسلم ـ مِنْ طَوَافِ الْبَيْتِ أَتَى مَقَامَ إِبْرَاهِيمَ فَقَالَ عُمَرُ يَا رَسُولَ اللَّهِ هَذَا مَقَامُ أَبِينَا إِبْرَاهِيمَ الَّذِي قَالَ اللَّهُ {وَاتَّخِذُوا مِنْ مَقَامِ إِبْرَاهِيمَ مُصَلًّى } . قَالَ الْوَلِيدُ فَقُلْتُ لِمَالِكٍ أَهَكَذَا قَرَأَ {وَاتَّخِذُوا} قَالَ نَعَمْ .,জাবির (রাঃ) থেকে বর্ণিত:,"তিনি বলেন, রসূলুল্লাহ (সাল্লাল্লাহু ‘আলাইহি ওয়া সাল্লাম) বায়তুল্লাহ (কা‘বা ঘর) তাওয়াফ শেষে মাকামে ইবরাহীমে আসেন। তখন উমার (রাঃ) বলেন, হে আল্লাহর রসূল! এটা তো আমাদের পিতা ইবরাহীম (আঃ) -এর মাকাম, যে সম্পর্কে আল্লাহ তাআলা বলেছেন (অনুবাদ) : “তোমারা মাকামে ইবরাহীমকে সলাতের স্থানরূপে গ্রহণ করো” (সূরা বাকারাঃ ১২৫)। ওলীদ বিন মুসলিম (রাঃ) বলেন, আমি ইমাম মালিক (রাঃ) -কে জিজ্ঞেস করলাম, তিনি কি এভাবে “ওয়াত্তাখিযু” পড়েছেন? তিনি বলেন, হাঁ।[১০০৮]"
সুনানে ইবনে মাজাহ,১০০৯,,حَدَّثَنَا مُحَمَّدُ بْنُ الصَّبَّاحِ، حَدَّثَنَا هُشَيْمٌ، عَنْ حُمَيْدٍ الطَّوِيلِ، عَنْ أَنَسِ بْنِ مَالِكٍ، قَالَ قَالَ عُمَرُ قُلْتُ يَا رَسُولَ اللَّهِ لَوِ اتَّخَذْتَ مِنْ مَقَامِ إِبْرَاهِيمَ مُصَلًّى فَنَزَلَتْ {وَاتَّخِذُوا مِنْ مَقَامِ إِبْرَاهِيمَ مُصَلًّى} .,আনাস বিন মালিক থেকে বর্ণিত:,"উমার (রাঃ) বলেন, হে আল্লাহর রসূল! যদি আপনি মাকামে ইবরাহীমকে সলাতের স্থানরূপে গ্রহণ করতেন! তখন নাযিল হলোঃ “তোমরা ইবরাহীমের দাঁড়ানোর স্থানকে সলাতের স্থানরূপে গ্রহণ করো” (সূরা বাকারাঃ ১২৫)।[১০০৯]"
সুনানে ইবনে মাজাহ,১০১০,,"حَدَّثَنَا عَلْقَمَةُ بْنُ عَمْرٍو الدَّارِمِيُّ، حَدَّثَنَا أَبُو بَكْرِ بْنُ عَيَّاشٍ، عَنْ أَبِي إِسْحَاقَ، عَنِ الْبَرَاءِ، قَالَ صَلَّيْنَا مَعَ رَسُولِ اللَّهِ ـ صلى الله عليه وسلم ـ نَحْوَ بَيْتِ الْمَقْدِسِ ثَمَانِيَةَ عَشَرَ شَهْرًا وَصُرِفَتِ الْقِبْلَةُ إِلَى الْكَعْبَةِ بَعْدَ دُخُولِهِ إِلَى الْمَدِينَةِ بِشَهْرَيْنِ وَكَانَ رَسُولُ اللَّهِ ـ صلى الله عليه وسلم ـ إِذَا صَلَّى إِلَى بَيْتِ الْمَقْدِسِ أَكْثَرَ تَقَلُّبَ وَجْهِهِ فِي السَّمَاءِ وَعَلِمَ اللَّهُ مِنْ قَلْبِ نَبِيِّهِ ـ صلى الله عليه وسلم ـ أَنَّهُ يَهْوَى الْكَعْبَةَ فَصَعِدَ جِبْرِيلُ فَجَعَلَ رَسُولُ اللَّهِ ـ صلى الله عليه وسلم ـ يُتْبِعُهُ بَصَرَهُ وَهُوَ يَصْعَدُ بَيْنَ السَّمَاءِ وَالأَرْضِ يَنْظُرُ مَا يَأْتِيهِ بِهِ فَأَنْزَلَ اللَّهُ {قَدْ نَرَى تَقَلُّبَ وَجْهِكَ فِي السَّمَاءِ} الآيَةَ فَأَتَانَا آتٍ فَقَالَ إِنَّ الْقِبْلَةَ قَدْ صُرِفَتْ إِلَى الْكَعْبَةِ وَقَدْ صَلَّيْنَا رَكْعَتَيْنِ إِلَى بَيْتِ الْمَقْدِسِ وَنَحْنُ رُكُوعٌ فَتَحَوَّلْنَا فَبَنَيْنَا عَلَى مَا مَضَى مِنْ صَلاَتِنَا فَقَالَ رَسُولُ اللَّهِ ـ صلى الله عليه وسلم ـ "" يَا جِبْرِيلُ كَيْفَ حَالُنَا فِي صَلاَتِنَا إِلَى بَيْتِ الْمَقْدِسِ "" . فَأَنْزَلَ اللَّهُ عَزَّ وَجَلَّ {وَمَا كَانَ اللَّهُ لِيُضِيعَ إِيمَانَكُمْ} .",আল-বারা’ (রাঃ) থেকে বর্ণিত:,"তিনি বলেন, আমরা আঠার মাস যাবত রসূলুল্লাহ (সাল্লাল্লাহু ‘আলাইহি ওয়া সাল্লাম) -এর সাথে বাইতুল মাকদিসের দিকে মুখ করে সালাত পড়ি। তাঁর হিজরত করে মদীনাহ্য় আসার দু’মাস পর কাবা শরীফের দিকে কিবলা পরিবর্তিত করা হয়। রসূলুল্লাহ (সাল্লাল্লাহু ‘আলাইহি ওয়া সাল্লাম) যখন বাইতুল মাকদিসের দিকে মুখ করে সালাত আদায় করতেন, তখন অধিকাংশ সময় তিনি তাঁর মুখমণ্ডল আকাশের দিকে ফিরাতেন। আল্লাহ তাঁর নবীর মনের আকাঙ্খা জানতেন যে, তিনি কাবাকে পছন্দ করেন। জিবরাঈল (আঃ) আরোহণ করেন এবং রসূলুল্লাহ (সাল্লাল্লাহু ‘আলাইহি ওয়া সাল্লাম) -এর দৃষ্টি তাঁর অনুসরণ করে। তিনি আসমান ও যমীনের মাঝখান দিয়ে অগ্রসর হন। নবী (সাল্লাল্লাহু ‘আলাইহি ওয়া সাল্লাম) লক্ষ্য করেন, তিনি কী হুকুম নিয়ে আসেন তাঁর জন্য। তখন আল্লাহ এ আয়াত নাযিল করেন (অনুবাদ) : “আকাশের দিকে তোমর বারবার তাকানোকে আমি অবশ্য লক্ষ্য করছি ….” (সূরা বাকারাঃ ১৪৪)। এরপর আমাদের কাছে একজন আগন্তুক এসে বলেন, নিশ্চয় কিবলা তো কাবার দিকে পরিবর্তিত করা হয়েছে। ইতোমধ্যে বায়তুল মাকদিসকে কিবলা করে আমাদের দু’রাকআত সালাত পড়া হয়েছে। আমরা রুকূ‘তে থাকা অবস্থায় (নতুন) কিবলার দিকে ঘুরে গেলাম এবং আমাদের অবশিষ্ট সালাত বাইতুল্লাহর দিকে ফিরে পড়লাম। রসূলুল্লাহ (সাল্লাল্লাহু ‘আলাইহি ওয়া সাল্লাম) বলেন, হে জিবরাঈল! আমাদের বাইতুল মাকদিসের সলাতের অবস্থা কী? তখন মহান আল্লাহ এ আয়াত নাযিল করেন (অনুবাদ) : “আল্লাহ এরূপ নন যে, তোমদের ঈমান নষ্ট করবেন” (সূরা বাকারাঃ ১৪৩)। [১০১০]"
সুনানে ইবনে মাজাহ,১০১১,,"حَدَّثَنَا مُحَمَّدُ بْنُ يَحْيَى الأَزْدِيُّ، حَدَّثَنَا هَاشِمُ بْنُ الْقَاسِمِ، ح وَحَدَّثَنَا مُحَمَّدُ بْنُ يَحْيَى النَّيْسَابُورِيُّ، قَالَ حَدَّثَنَا عَاصِمُ بْنُ عَلِيٍّ، قَالاَ حَدَّثَنَا أَبُو مَعْشَرٍ، عَنْ مُحَمَّدِ بْنِ عَمْرٍو، عَنْ أَبِي سَلَمَةَ، عَنْ أَبِي هُرَيْرَةَ، قَالَ قَالَ رَسُولُ اللَّهِ ـ صلى الله عليه وسلم ـ "" مَا بَيْنَ الْمَشْرِقِ وَالْمَغْرِبِ قِبْلَةٌ "" .",আবূ হুরায়রা (রাঃ) থেকে বর্ণিত:,"তিনি বলেন, রসূলুল্লাহ (সাল্লাল্লাহু ‘আলাইহি ওয়া সাল্লাম) বলেছেন, পূর্ব ও পশ্চিমের মাঝখানে কিবলা অবস্থিত। [১০১১]"
সুনানে ইবনে মাজাহ,১০১২,,"حَدَّثَنَا إِبْرَاهِيمُ بْنُ الْمُنْذِرِ الْحِزَامِيُّ، وَيَعْقُوبُ بْنُ حُمَيْدِ بْنِ كَاسِبٍ، قَالاَ حَدَّثَنَا ابْنُ أَبِي فُدَيْكٍ، عَنْ كَثِيرِ بْنِ زَيْدٍ، عَنِ الْمُطَّلِبِ بْنِ عَبْدِ اللَّهِ، عَنْ أَبِي هُرَيْرَةَ، أَنَّ رَسُولَ اللَّهِ ـ صلى الله عليه وسلم ـ قَالَ "" إِذَا دَخَلَ أَحَدُكُمُ الْمَسْجِدَ فَلاَ يَجْلِسْ حَتَّى يَرْكَعَ رَكْعَتَيْنِ "" .",আবূ হুরায়রা (রাঃ) থেকে বর্ণিত:,"রসূলুল্লাহ (সাল্লাল্লাহু ‘আলাইহি ওয়া সাল্লাম) বলেন, তোমাদের কেউ মাসজিদে প্রবেশ করলে সে যেন দু’ রাকআত সালাত না পড়া পর্যন্ত না বসে।[১০১২]"
সুনানে ইবনে মাজাহ,১০১৩,,"حَدَّثَنَا الْعَبَّاسُ بْنُ عُثْمَانَ، حَدَّثَنَا الْوَلِيدُ بْنُ مُسْلِمٍ، حَدَّثَنَا مَالِكُ بْنُ أَنَسٍ، عَنْ عَامِرِ بْنِ عَبْدِ اللَّهِ بْنِ الزُّبَيْرِ، عَنْ عَمْرِو بْنِ سُلَيْمٍ الزُّرَقِيِّ، عَنْ أَبِي قَتَادَةَ، أَنَّ النَّبِيَّ ـ صلى الله عليه وسلم ـ قَالَ "" إِذَا دَخَلَ أَحَدُكُمُ الْمَسْجِدَ فَلْيُصَلِّ رَكْعَتَيْنِ قَبْلَ أَنْ يَجْلِسَ "" .",হারিস বিন রিবঈ (রাঃ) থেকে বর্ণিত:,"নবী (সাল্লাল্লাহু ‘আলাইহি ওয়া সাল্লাম) বলেন, তোমাদের কোন ব্যক্তি মাসজিদে প্রবেশ করলে সে যেন বসার আগে দু’ রাকআত সালাত পড়ে।[১০১৩]"
সুনানে ইবনে মাজাহ,১০১৪,,حَدَّثَنَا أَبُو بَكْرِ بْنُ أَبِي شَيْبَةَ، حَدَّثَنَا إِسْمَاعِيلُ ابْنُ عُلَيَّةَ، عَنْ سَعِيدِ بْنِ أَبِي عَرُوبَةَ، عَنْ قَتَادَةَ، عَنْ سَالِمِ بْنِ أَبِي الْجَعْدِ الْغَطَفَانِيِّ، عَنْ مَعْدَانَ بْنِ أَبِي طَلْحَةَ الْيَعْمُرِيِّ، أَنَّ عُمَرَ بْنَ الْخَطَّابِ، قَامَ يَوْمَ الْجُمُعَةِ خَطِيبًا - أَوْ خَطَبَ يَوْمَ الْجُمُعَةِ - فَحَمِدَ اللَّهَ وَأَثْنَى عَلَيْهِ ثُمَّ قَالَ يَا أَيُّهَا النَّاسُ إِنَّكُمْ تَأْكُلُونَ شَجَرَتَيْنِ لاَ أُرَاهُمَا إِلاَّ خَبِيثَتَيْنِ هَذَا الثُّومُ وَهَذَا الْبَصَلُ وَلَقَدْ كُنْتُ أَرَى الرَّجُلَ عَلَى عَهْدِ رَسُولِ اللَّهِ ـ صلى الله عليه وسلم ـ يُوجَدُ رِيحُهُ مِنْهُ فَيُؤْخَذُ بِيَدِهِ حَتَّى يُخْرَجَ إِلَى الْبَقِيعِ فَمَنْ كَانَ آكِلَهَا لاَ بُدَّ فَلْيُمِتْهَا طَبْخًا .,উমার ইবনুল খাত্তাব (রাঃ) থেকে বর্ণিত:,"উমার ইবনুল খাত্তাব (রাঃ) জুমুআহর খুতবাহ দিতে দাঁড়ান অথবা তিনি জুমুআহর দিন খুতবাহ দেন। তিনি আল্লাহর প্রশংসা ও গুণগান করার পর বলেন, হে লোকসকল! তোমরা দু’টি গাছ খেয়ে থাকো, আমার দৃষ্টিতে তা নিকৃষ্টঃ এই রসুন ও এই পিয়াজ। আমি রসূলুল্লাহ (সাল্লাল্লাহু ‘আলাইহি ওয়া সাল্লাম) -এর যুগে দেখতাম, যার মুখ থেকে এর দুর্গন্ধ পাওয়া যেতো, তার হাত ধরে তাকে আল-বাকী নামক স্থানের দিকে বের করে দেয়া হতো। অতএব যে ব্যক্তি তা খেতেই চায়, সে যেন তা রান্না করে খায়। [১০১৪]"
