বই,হাদিস নাম্বার,হাদিসের মান,আরবি,বর্ণনাকারী,বাংলা
সুনানে ইবনে মাজাহ,১০৯৮,,"حَدَّثَنَا عَمَّارُ بْنُ خَالِدٍ الْوَاسِطِيُّ، حَدَّثَنَا عَلِيُّ بْنُ غُرَابٍ، عَنْ صَالِحِ بْنِ أَبِي الأَخْضَرِ، عَنِ الزُّهْرِيِّ، عَنْ عُبَيْدِ بْنِ السَّبَّاقِ، عَنِ ابْنِ عَبَّاسٍ، قَالَ قَالَ رَسُولُ اللَّهِ ـ صلى الله عليه وسلم ـ "" إِنَّ هَذَا يَوْمُ عِيدٍ جَعَلَهُ اللَّهُ لِلْمُسْلِمِينَ فَمَنْ جَاءَ إِلَى الْجُمُعَةِ فَلْيَغْتَسِلْ وَإِنْ كَانَ طِيبٌ فَلْيَمَسَّ مِنْهُ وَعَلَيْكُمْ بِالسِّوَاكِ "" .",ইবনু আব্বাস (রাঃ) থেকে বর্ণিত:,"তিনি বলেন, রসূলুল্লাহ (সাল্লাল্লাহু ‘আলাইহি ওয়া সাল্লাম) বলেছেন, নিশ্চয় আল্লাহ এই দিনকে মুসলিমদের ঈদের দিনরূপে নির্ধারণ করেছেন। অতএব যে ব্যক্তি জুমুআহ্‌র সালাত আদায় করতে আসবে সে যেন গোসল করে এবং সুগন্ধি থাকলে তা শরীরে লাগায়। আর মিসওয়াক করাও তোমাদের কর্তব্য। [১০৯৮]"
সুনানে ইবনে মাজাহ,১০৯৯,,حَدَّثَنَا مُحَمَّدُ بْنُ الصَّبَّاحِ، حَدَّثَنَا عَبْدُ الْعَزِيزِ بْنُ أَبِي حَازِمٍ، حَدَّثَنِي أَبِي، عَنْ سَهْلِ بْنِ سَعْدٍ، قَالَ مَا كُنَّا نَقِيلُ وَلاَ نَتَغَدَّى إِلاَّ بَعْدَ الْجُمُعَةِ .,সাহল বিন সা‘দ (রাঃ) থেকে বর্ণিত:,"তিনি বলেন, আমরা জুমুআহ্‌র সালাত পড়ার পরেই দুপুরের আহার করতাম এবং বিশ্রাম নিতাম। [১০৯৯]"
সুনানে ইবনে মাজাহ,১১০০,,حَدَّثَنَا مُحَمَّدُ بْنُ بَشَّارٍ، حَدَّثَنَا عَبْدُ الرَّحْمَنِ بْنُ مَهْدِيٍّ، حَدَّثَنَا يَعْلَى بْنُ الْحَارِثِ، قَالَ سَمِعْتُ إِيَاسَ بْنَ سَلَمَةَ بْنِ الأَكْوَعِ، عَنْ أَبِيهِ، قَالَ كُنَّا نُصَلِّي مَعَ النَّبِيِّ ـ صلى الله عليه وسلم ـ الْجُمُعَةَ ثُمَّ نَرْجِعُ فَلاَ نَرَى لِلْحِيطَانِ فَيْئًا نَسْتَظِلُّ بِهِ .,সালামাহ বিন আমর ইবনুল আকওয়া’ (রাঃ) থেকে বর্ণিত:,"তিনি বলেন, আমরা নবী (সাল্লাল্লাহু ‘আলাইহি ওয়া সাল্লাম) -এর সাথে জুমুআহ্‌র সালাত পড়ে ফেরার সময় দেয়ালের এতটুকু ছায়াও দেখতাম না যার ছায়া আমরা গ্রহণ করতে পারি। [১১০০]"
সুনানে ইবনে মাজাহ,১১০১,,حَدَّثَنَا هِشَامُ بْنُ عَمَّارٍ، حَدَّثَنَا عَبْدُ الرَّحْمَنِ بْنُ سَعْدِ بْنِ عَمَّارِ بْنِ سَعْدٍ، مُؤَذِّنِ النَّبِيِّ ـ صلى الله عليه وسلم ـ حَدَّثَنِي أَبِي عَنْ أَبِيهِ عَنْ جَدِّهِ أَنَّهُ كَانَ يُؤَذِّنُ يَوْمَ الْجُمُعَةِ عَلَى عَهْدِ رَسُولِ اللَّهِ ـ صلى الله عليه وسلم ـ إِذَا كَانَ الْفَىْءُ مِثْلَ الشِّرَاكِ .,সা‘দ বিন আয়িয (রাঃ) থেকে বর্ণিত:,তিনি রসূলুল্লাহ (সাল্লাল্লাহু ‘আলাইহি ওয়া সাল্লাম) -এর সময়ে সূর্য পশ্চিমাকাশে জুতার ফিতার ন্যায় ঢলে পড়ার পর আযান দিতেন। [১১০১]
সুনানে ইবনে মাজাহ,১১০২,,حَدَّثَنَا أَحْمَدُ بْنُ عَبْدَةَ، حَدَّثَنَا الْمُعْتَمِرُ بْنُ سُلَيْمَانَ، حَدَّثَنَا حُمَيْدٌ، عَنْ أَنَسٍ، قَالَ كُنَّا نُجَمِّعُ ثُمَّ نَرْجِعُ فَنَقِيلُ .,আনাস (রাঃ) থেকে বর্ণিত:,"তিনি বলেন, আমরা জুমুআহ্‌র সালাত পড়ে ফিরে আসার পর দুপুরের বিশ্রাম করতাম। [১১০২]"
সুনানে ইবনে মাজাহ,১১০৩,,حَدَّثَنَا مَحْمُودُ بْنُ غَيْلاَنَ، حَدَّثَنَا عَبْدُ الرَّزَّاقِ، أَنْبَأَنَا مَعْمَرٌ، عَنْ عُبَيْدِ اللَّهِ بْنِ عُمَرَ، عَنْ نَافِعٍ، عَنِ ابْنِ عُمَرَ، ح وَحَدَّثَنَا يَحْيَى بْنُ خَلَفٍ أَبُو سَلَمَةَ، حَدَّثَنَا بِشْرُ بْنُ الْمُفَضَّلِ، عَنْ عُبَيْدِ اللَّهِ، عَنْ نَافِعٍ، عَنِ ابْنِ عُمَرَ، أَنَّ النَّبِيَّ ـ صلى الله عليه وسلم ـ كَانَ يَخْطُبُ خُطْبَتَيْنِ يَجْلِسُ بَيْنَهُمَا جَلْسَةً . زَادَ بِشْرٌ وَهُوَ قَائِمٌ .,ইবনু উমার (রাঃ) থেকে বর্ণিত:,নবী (সাল্লাল্লাহু ‘আলাইহি ওয়া সাল্লাম) (জুমুআহ্‌র সলাতের) দু’টি খুতবাহ দিতেন এবং দু’ খুতবাহ্‌র মাঝখানে কিছুক্ষণ বসতেন। বিশর (রাঃ) -এর বর্ণনায় আরো আছেঃ তিনি দাঁড়িয়ে খুতবাহ দিতেন। [১১০৩]
সুনানে ইবনে মাজাহ,১১০৪,,حَدَّثَنَا هِشَامُ بْنُ عَمَّارٍ، حَدَّثَنَا سُفْيَانُ بْنُ عُيَيْنَةَ، عَنْ مُسَاوِرٍ الْوَرَّاقِ، عَنْ جَعْفَرِ بْنِ عَمْرِو بْنِ حُرَيْثٍ، عَنْ أَبِيهِ، قَالَ رَأَيْتُ النَّبِيَّ ـ صلى الله عليه وسلم ـ يَخْطُبُ عَلَى الْمِنْبَرِ وَعَلَيْهِ عِمَامَةٌ سَوْدَاءُ .,আমর বিন হুরায়স (রাঃ) থেকে বর্ণিত:,"তিনি বলেন, আমি নবী (সাল্লাল্লাহু ‘আলাইহি ওয়া সাল্লাম) -কে কালো পাগড়ি পরিহিত অবস্থায় মিম্বারে দাঁড়িয়ে খুতবা দিতে দেখেছি। [১১০৪]"
সুনানে ইবনে মাজাহ,১১০৫,,حَدَّثَنَا مُحَمَّدُ بْنُ بَشَّارٍ، وَمُحَمَّدُ بْنُ الْوَلِيدِ، قَالاَ حَدَّثَنَا مُحَمَّدُ بْنُ جَعْفَرٍ، حَدَّثَنَا شُعْبَةُ، عَنْ سِمَاكِ بْنِ حَرْبٍ، قَالَ سَمِعْتُ جَابِرَ بْنَ سَمُرَةَ، يَقُولُ كَانَ رَسُولُ اللَّهِ ـ صلى الله عليه وسلم ـ يَخْطُبُ قَائِمًا غَيْرَ أَنَّهُ كَانَ يَقْعُدُ قَعْدَةً ثُمَّ يَقُومُ .,জাবির বিন সামুরাহ (রাঃ) থেকে বর্ণিত:,"তিনি বলেন, রসূলুল্লাহ (সাল্লাল্লাহু ‘আলাইহি ওয়া সাল্লাম) দাঁড়িয়ে খুতবাহ দিতেন। তবে তিনি একবার কিছুক্ষণ বসতেন, অতঃপর (দ্বিতীয় খুতবাহ দিতে) দাঁড়াতেন। [১১০৫]"
সুনানে ইবনে মাজাহ,১১০৬,,حَدَّثَنَا عَلِيُّ بْنُ مُحَمَّدٍ، حَدَّثَنَا وَكِيعٌ، ح وَحَدَّثَنَا مُحَمَّدُ بْنُ بَشَّارٍ، حَدَّثَنَا عَبْدُ الرَّحْمَنِ بْنُ مَهْدِيٍّ، قَالاَ حَدَّثَنَا سُفْيَانُ، عَنْ سِمَاكٍ، عَنْ جَابِرِ بْنِ سَمُرَةَ، قَالَ كَانَ النَّبِيُّ ـ صلى الله عليه وسلم ـ يَخْطُبُ قَائِمًا ثُمَّ يَجْلِسُ ثُمَّ يَقُومُ فَيَقْرَأُ آيَاتٍ وَيَذْكُرُ اللَّهَ وَكَانَتْ خُطْبَتُهُ قَصْدًا وَصَلاَتُهُ قَصْدًا .,জাবির বিন সামুরাহ (রাঃ) থেকে বর্ণিত:,"তিনি বলেন, নবী (সাল্লাল্লাহু ‘আলাইহি ওয়া সাল্লাম) দাঁড়িয়ে খুতবাহ দিতেন, তারপর (প্রথম খুতবাহ শেষে) বসতেন, অতঃপর দাঁড়িয়ে কুরআনের আয়াত পড়তেন এবং আল্লাহ্‌র যিকির করতেন। তাঁর খুতবাহ ও সালাত দু’টোই ছিল নাতিদীর্ঘ। [১১০৬]"
সুনানে ইবনে মাজাহ,১১০৭,,حَدَّثَنَا هِشَامُ بْنُ عَمَّارٍ، حَدَّثَنَا عَبْدُ الرَّحْمَنِ بْنُ سَعْدِ بْنِ عَمَّارِ بْنِ سَعْدٍ، حَدَّثَنِي أَبِي، عَنْ أَبِيهِ، عَنْ جَدِّهِ، أَنَّ رَسُولَ اللَّهِ ـ صلى الله عليه وسلم ـ كَانَ إِذَا خَطَبَ فِي الْحَرْبِ خَطَبَ عَلَى قَوْسٍ وَإِذَا خَطَبَ فِي الْجُمُعَةِ خَطَبَ عَلَى عَصًا .,সা‘দ বিন আয়িয (রাঃ) থেকে বর্ণিত:,রসূলুল্লাহ (সাল্লাল্লাহু ‘আলাইহি ওয়া সাল্লাম) যুদ্ধক্ষেত্রে খুতবাহ দিলে ধনুকে ভর করে খুতবাহ দিতেন এবং জুমুআহ্‌র খুতবাহ দিলে লাঠিতে ভর দিয়ে খুতবাহ দিতেন। [১১০৭]
সুনানে ইবনে মাজাহ,১১০৮,,حَدَّثَنَا أَبُو بَكْرِ بْنُ أَبِي شَيْبَةَ، حَدَّثَنَا ابْنُ أَبِي غَنِيَّةَ، عَنِ الأَعْمَشِ، عَنْ إِبْرَاهِيمَ، عَنْ عَلْقَمَةَ، عَنْ عَبْدِ اللَّهِ، أَنَّهُ سُئِلَ أَكَانَ النَّبِيُّ ـ صلى الله عليه وسلم ـ يَخْطُبُ قَائِمًا أَوْ قَاعِدًا قَالَ أَوَمَا تَقْرَأُ {وَتَرَكُوكَ قَائِمًا} قَالَ أَبُو عَبْدِ اللَّهِ غَرِيبٌ لاَ يُحَدِّثُ بِهِ إِلاَّ ابْنُ أَبِي شَيْبَةَ وَحْدَهُ .,আবদুল্লাহ (রাঃ) থেকে বর্ণিত:,"তাকে জিজ্ঞেস করা হলো, নবী (সাল্লাল্লাহু ‘আলাইহি ওয়া সাল্লাম) কি দাঁড়িয়ে খুতবাহ দিতেন, না বসে? তিনি বলেন, তুমি কি এ আয়াত পাঠ করোনিঃ “এবং তারা তোমাকে রেখে গেল দাঁড়ানো অবস্থায়” (সূরা জুমুআহঃ ১১)? [১১০৮]"
সুনানে ইবনে মাজাহ,১১০৯,,حَدَّثَنَا مُحَمَّدُ بْنُ يَحْيَى، حَدَّثَنَا عَمْرُو بْنُ خَالِدٍ، حَدَّثَنَا ابْنُ لَهِيعَةَ، عَنْ مُحَمَّدِ بْنِ زَيْدِ بْنِ مُهَاجِرٍ، عَنْ مُحَمَّدِ بْنِ الْمُنْكَدِرِ، عَنْ جَابِرِ بْنِ عَبْدِ اللَّهِ، أَنَّ النَّبِيَّ ـ صلى الله عليه وسلم ـ كَانَ إِذَا صَعِدَ الْمِنْبَرَ سَلَّمَ .,জাবির বিন আবদুল্লাহ্ (রাঃ) থেকে বর্ণিত:,নবী (সাল্লাল্লাহু ‘আলাইহি ওয়া সাল্লাম) মিম্বারে উঠে সালাম দিতেন। হাসান। [১১০৯]
সুনানে ইবনে মাজাহ,১১১০,,"حَدَّثَنَا أَبُو بَكْرِ بْنُ أَبِي شَيْبَةَ، حَدَّثَنَا شَبَابَةُ بْنُ سَوَّارٍ، عَنِ ابْنِ أَبِي ذِئْبٍ، عَنِ الزُّهْرِيِّ، عَنْ سَعِيدِ بْنِ الْمُسَيَّبِ، عَنْ أَبِي هُرَيْرَةَ، أَنَّ النَّبِيَّ ـ صلى الله عليه وسلم ـ قَالَ "" إِذَا قُلْتَ لِصَاحِبِكَ أَنْصِتْ يَوْمَ الْجُمُعَةِ وَالإِمَامُ يَخْطُبُ فَقَدْ لَغَوْتَ "" .",আবূ হুরায়রা (রাঃ) থেকে বর্ণিত:,"নবী (সাল্লাল্লাহু ‘আলাইহি ওয়া সাল্লাম) বলেন, জুমুআহ্‌র দিন ইমামের খুতবাহ দানকালে যখন তুমি তোমার সাথীকে বললে, ‘চুপ করো’ তখন তুমি অনর্থক কাজ করলে। [১১১০]"
সুনানে ইবনে মাজাহ,১১১১,,"حَدَّثَنَا مُحْرِزُ بْنُ سَلَمَةَ الْعَدَنِيُّ، حَدَّثَنَا عَبْدُ الْعَزِيزِ بْنُ مُحَمَّدٍ الدَّرَاوَرْدِيُّ، عَنْ شَرِيكِ بْنِ عَبْدِ اللَّهِ بْنِ أَبِي نَمِرٍ، عَنْ عَطَاءِ بْنِ يَسَارٍ، عَنْ أُبَىِّ بْنِ كَعْبٍ، أَنَّ رَسُولَ اللَّهِ ـ صلى الله عليه وسلم ـ قَرَأَ يَوْمَ الْجُمُعَةِ تَبَارَكَ وَهُوَ قَائِمٌ فَذَكَّرَنَا بِأَيَّامِ اللَّهِ وَأَبُو الدَّرْدَاءِ أَوْ أَبُو ذَرٍّ يَغْمِزُنِي فَقَالَ مَتَى أُنْزِلَتْ هَذِهِ السُّورَةُ إِنِّي لَمْ أَسْمَعْهَا إِلاَّ الآنَ . فَأَشَارَ إِلَيْهِ أَنِ اسْكُتْ فَلَمَّا انْصَرَفُوا قَالَ سَأَلْتُكَ مَتَى أُنْزِلَتْ هَذِهِ السُّورَةُ فَلَمْ تُخْبِرْنِي فَقَالَ أُبَىٌّ لَيْسَ لَكَ مِنْ صَلاَتِكَ الْيَوْمَ إِلاَّ مَا لَغَوْتَ . فَذَهَبَ إِلَى رَسُولِ اللَّهِ ـ صلى الله عليه وسلم ـ فَذَكَرَ ذَلِكَ لَهُ وَأَخْبَرَهُ بِالَّذِي قَالَ أُبَىٌّ فَقَالَ رَسُولُ اللَّهِ ـ صلى الله عليه وسلم ـ "" صَدَقَ أُبَىٌّ "" .",উবাই বিন কা‘ব (রাঃ) থেকে বর্ণিত:,"রসূলুল্লাহ (সাল্লাল্লাহু ‘আলাইহি ওয়া সাল্লাম) জুমুআহ্‌র সলাতে (খুতবাহ দিতে) দাঁড়িয়ে সূরা তাবারাকা (মূল্‌ক) পাঠ করেন এবং আমাদের উদ্দেশে আল্লাহ্‌র দিনসমূহের ইতিহাস বর্ণনা করেন। আবূদ-দারদা’ অথবা আবূ যার (রাঃ) আমাকে খোঁচা মেরে বলেন, সূরাটি কখন নাযিল হয়েছে? আমি তো তা এখনই শুনলাম। তিনি তার দিকে ইশারা করে বলেন, চুপ করুন। সাহাবীরা চলে গেলে তিনি বলেন, আমি আপনাকে জিজ্ঞেস করলাম সূরাটি কখন নাযিল হয়েছে, অথচ আপনি আমাকে তা অবহিত করেননি? উবাই (রাঃ) বলেন, আজকে আপনার সালাত হয়নি, অনর্থক কাজই হয়েছে। তিনি রসূলুল্লাহ (সাল্লাল্লাহু ‘আলাইহি ওয়া সাল্লাম) -এর নিকট উপস্থিত হয়ে বিষয়টি তাঁকে বর্ণনা করেন এবং উবাই (রাঃ) যা বলেছেন, তাঁকে তাও অবহিত করেন। রসূলুল্লাহ (সাল্লাল্লাহু ‘আলাইহি ওয়া সাল্লাম) বলেন, উবাই ঠিকই বলেছেন। [১১১১]"
সুনানে ইবনে মাজাহ,১১১২,,"حَدَّثَنَا هِشَامُ بْنُ عَمَّارٍ، حَدَّثَنَا سُفْيَانُ بْنُ عُيَيْنَةَ، عَنْ عَمْرِو بْنِ دِينَارٍ، سَمِعَ جَابِرًا، وَأَبُو الزُّبَيْرِ، سَمِعَ جَابِرَ بْنَ عَبْدِ اللَّهِ، قَالَ دَخَلَ سُلَيْكٌ الْغَطَفَانِيُّ الْمَسْجِدَ وَالنَّبِيُّ ـ صلى الله عليه وسلم ـ يَخْطُبُ . فَقَالَ "" أَصَلَّيْتَ "" . قَالَ لاَ . قَالَ "" فَصَلِّ رَكْعَتَيْنِ "" . وَأَمَّا عَمْرٌو فَلَمْ يَذْكُرْ سُلَيْكًا .",জাবির বিন আবদুল্লাহ (রাঃ) থেকে বর্ণিত:,"তিনি বলেন, নবী (সাল্লাল্লাহু ‘আলাইহি ওয়া সাল্লাম) -এর খুতবাহ দানকালে সুলাইক আল-গাতাফানী (সাল্লাল্লাহু ‘আলাইহি ওয়া সাল্লাম) মাসজিদে প্রবেশ করেন। তিনি বলেন, তুমি কি সালাত পড়েছ? সে বললো, না। তিনি বলেন, তুমি দু’রাকাআত পড়ে নাও। রাবী আম্‌র বিন দীনারের বর্ণনায় সুলাইক (রাঃ) -এর নাম উল্লেখিত হয়নি। [১১১২]"
সুনানে ইবনে মাজাহ,১১১৩,,"حَدَّثَنَا مُحَمَّدُ بْنُ الصَّبَّاحِ، أَنْبَأَنَا سُفْيَانُ بْنُ عُيَيْنَةَ، عَنِ ابْنِ عَجْلاَنَ، عَنْ عِيَاضِ بْنِ عَبْدِ اللَّهِ، عَنْ أَبِي سَعِيدٍ، قَالَ جَاءَ رَجُلٌ وَالنَّبِيُّ ـ صلى الله عليه وسلم ـ يَخْطُبُ فَقَالَ "" أَصَلَّيْتَ "" . قَالَ لاَ . قَالَ "" فَصَلِّ رَكْعَتَيْنِ "" .",আবূ সাঈদ (রাঃ) থেকে বর্ণিত:,"তিনি বলেন, নবী (সাল্লাল্লাহু ‘আলাইহি ওয়া সাল্লাম) -এর খুতবাহ দানকালে এক ব্যক্তি এসে উপস্থিত হলো। তিনি বলেন, তুমি কি সালাত পড়েছ? সে বললো, না। তিনি বলেন, তুমি দু’ রাকআত পড়ে নাও। [১১১৩]"
সুনানে ইবনে মাজাহ,১১১৪,,"حَدَّثَنَا دَاوُدُ بْنُ رُشَيْدٍ، حَدَّثَنَا حَفْصُ بْنُ غِيَاثٍ، عَنِ الأَعْمَشِ، عَنْ أَبِي صَالِحٍ، عَنْ أَبِي هُرَيْرَةَ، وَعَنْ أَبِي سُفْيَانَ، عَنْ جَابِرٍ، قَالاَ جَاءَ سُلَيْكٌ الْغَطَفَانِيُّ وَرَسُولُ اللَّهِ ـ صلى الله عليه وسلم ـ يَخْطُبُ فَقَالَ لَهُ النَّبِيُّ ـ صلى الله عليه وسلم ـ "" أَصَلَّيْتَ رَكْعَتَيْنِ قَبْلَ أَنْ تَجِيءَ "" قَالَ لاَ . قَالَ "" فَصَلِّ رَكْعَتَيْنِ وَتَجَوَّزْ فِيهِمَا "" .",জাবির (রাঃ) থেকে বর্ণিত:,"তারা বলেন, রসূলুল্লাহ (সাল্লাল্লাহু ‘আলাইহি ওয়া সাল্লাম) -এর খুতবারত অবস্থায় সুলাইক আল-গাতফানী (রাঃ) এলেন। নবী (সাল্লাল্লাহু ‘আলাইহি ওয়া সাল্লাম) তাকে বলেন, তুমি কি এখানে আসার পূর্বে দু’ রাকআত পড়েছ? সে বললো, না। তিনি বলেন, তুমি সংক্ষেপে দু’ রাকআত পড়ে নাও। [১১১৪] তাহকীক আলবানীঃ 'তুমি আসার পূর্বে' এ কথা ব্যতীত সহীহ্। এ কথাটি শায।"
সুনানে ইবনে মাজাহ,১১১৫,,"حَدَّثَنَا أَبُو كُرَيْبٍ، حَدَّثَنَا عَبْدُ الرَّحْمَنِ الْمُحَارِبِيُّ، عَنْ إِسْمَاعِيلَ بْنِ مُسْلِمٍ، عَنِ الْحَسَنِ، عَنْ جَابِرِ بْنِ عَبْدِ اللَّهِ، أَنَّ رَجُلاً، دَخَلَ الْمَسْجِدَ يَوْمَ الْجُمُعَةِ وَرَسُولُ اللَّهِ ـ صلى الله عليه وسلم ـ يَخْطُبُ فَجَعَلَ يَتَخَطَّى النَّاسَ فَقَالَ رَسُولُ اللَّهِ ـ صلى الله عليه وسلم ـ "" اجْلِسْ فَقَدْ آذَيْتَ وَآنَيْتَ "" .",জাবির বিন আবদুল্লাহ (রাঃ) থেকে বর্ণিত:,"জুমুআহ্‌র দিন রসূলুল্লাহ (সাল্লাল্লাহু ‘আলাইহি ওয়া সাল্লাম) -এর খুতবারত অবস্থায় এক ব্যক্তি মাসজিদে প্রবেশ করলো। সে লোকের ঘাড় ডিঙ্গিয়ে সামনে দিকে যাচ্ছিল। রসূলুল্লাহ (সাল্লাল্লাহু ‘আলাইহি ওয়া সাল্লাম) বলেন, তুমি বসো, তুমি (অন্যকে) কষ্ট দিয়েছ এবং অনর্থক কাজ করেছ। [১১১৫]"
সুনানে ইবনে মাজাহ,১১১৬,,"حَدَّثَنَا أَبُو كُرَيْبٍ، حَدَّثَنَا رِشْدِينُ بْنُ سَعْدٍ، عَنْ زَبَّانَ بْنِ فَائِدٍ، عَنْ سَهْلِ بْنِ مُعَاذِ بْنِ أَنَسٍ، عَنْ أَبِيهِ، قَالَ قَالَ رَسُولُ اللَّهِ ـ صلى الله عليه وسلم ـ "" مَنْ تَخَطَّى رِقَابَ النَّاسِ يَوْمَ الْجُمُعَةِ اتُّخِذَ جِسْرًا إِلَى جَهَنَّمَ "" .",মুআয বিন আনাস (রাঃ) থেকে বর্ণিত:,"তিনি বলেন, বসূলুল্লাহ (সাল্লাল্লাহু ‘আলাইহি ওয়া সাল্লাম) বলেছেন, যে ব্যক্তি জুমুআহ্‌র দিন লোকের ঘাড় ডিঙ্গিয়ে সামনে অগ্রসর হয়েছে, (কিয়ামাতের দিন) তাকে জাহান্নামের পুল বানানো হবে। [১১১৬]"
